{
  "id": "t1596",
  "type": "technique",
  "title": "Search Open Technical Databases",
  "shortTitle": "Search Open Technical Databases",
  "externalId": "T1596",
  "theme": "Reconnaissance",
  "summary": "Rather than sending a single packet, this technique consults third party collections of technical facts about the victim: domain registration records, certificate transparency logs, historical and passive domain name system records, routing data, internet wide scan datasets and internet of things search services. The attraction is that these repositories are free, already populated, and reveal history that live probing cannot recover, such as former hosting providers, retired subdomains and certificates issued for internal looking names. The adversary correlates them to reconstruct infrastructure, identify who hosts and protects the target, and spot weak points such as an expired certificate, a typo squatted service or an asset pointing at a decommissioned address. Because the queries go to the data provider rather than the victim, victim side telemetry is usually absent, and the practical controls are data governance ones: keep registration details accurate, understand what your certificates and domain name system records publish, and monitor for impersonating lookalike registrations. This complements active scanning, which confirms what the databases suggest.",
  "tags": [
    "reconnaissance",
    "open databases",
    "domain registration",
    "certificate transparency",
    "passive dns"
  ],
  "difficulty": "extreme",
  "relatedTopics": [],
  "sources": [
    {
      "label": "MITRE ATT&CK: Search Open Technical Databases",
      "url": "https://attack.mitre.org/techniques/T1596/"
    }
  ],
  "lastReviewed": "2026-10-24",
  "exercises": [
    {
      "title": "Search Open Technical Databases - EASY",
      "path": "exercises/techniques/T1596_EASY.html",
      "difficulty": "easy",
      "kind": "exam",
      "status": "published",
      "summary": "Recall and recognition: definitions, one clear answer, single-step questions."
    },
    {
      "title": "Search Open Technical Databases - MEDIUM",
      "path": "exercises/techniques/T1596_MEDIUM.html",
      "difficulty": "medium",
      "kind": "exam",
      "status": "published",
      "summary": "Application: read a short log or alert and choose the correct next step."
    },
    {
      "title": "Search Open Technical Databases - HARD",
      "path": "exercises/techniques/T1596_HARD.html",
      "difficulty": "hard",
      "kind": "exam",
      "status": "published",
      "summary": "Analysis: a multi-step scenario with distractors, evidence to weigh, and a reason to give."
    },
    {
      "title": "Search Open Technical Databases - EXTREMELY HARD",
      "path": "exercises/techniques/T1596_EXTREMELY_HARD.html",
      "difficulty": "extremely-hard",
      "kind": "exam",
      "status": "published",
      "summary": "Synthesis under pressure: incomplete evidence, competing priorities, and a decision you must defend."
    }
  ],
  "attributionNote": "Technique content is derived from the publicly available MITRE ATT&CK knowledge base. ATT&CK is a registered trademark of The MITRE Corporation. Cyber Pulse Academy is not affiliated with, endorsed by, or sponsored by MITRE, and this content is not official MITRE material.",
  "beginner": {
    "definition": "This is when an attacker uses public technical records to learn about you. These records describe your domain names, certificates, address ranges and past hosting. They are kept by registries and community projects, and anyone can read them.",
    "whyItMatters": "These records are free and need no contact with your systems. They also hold history, so an attacker can find names and addresses you stopped using years ago. Old records often point to systems nobody maintains any more. Your own logs will not show the search at all.",
    "howItWorks": [
      "The attacker looks up who registered your domain names and which name servers answer for them.",
      "They read certificate records, which list the names a certificate was issued for.",
      "They review historical name lookups to find subdomains and addresses you used before.",
      "They pull internet wide scan data to see which ports and services were seen on your addresses.",
      "They compare providers and network ranges to find hosting, mail and protection services.",
      "They combine everything into an infrastructure map and pick the weakest, least maintained point."
    ],
    "example": "Think of a town hall that keeps an open ledger of every shop, its owner and its previous addresses. Anyone can read the ledger and see that a shop moved twice and left an empty unit behind. The attacker never visits the town, yet they know which abandoned unit to try first.",
    "takeaways": [
      "Public records carry history, so retired domains and addresses still leak information.",
      "Keep registration contacts and certificate names accurate and review them regularly.",
      "Monitor for lookalike domain registrations that reuse your naming style."
    ]
  },
  "objectives": [
    "Name the main open technical databases relevant to reconnaissance.",
    "Explain what domain registration and certificate transparency records reveal.",
    "Describe how passive and historical domain name system data exposes retired infrastructure.",
    "Explain why this collection is largely invisible in victim side telemetry.",
    "Suggest governance steps that limit information exposed through public records."
  ],
  "isSubTechnique": false,
  "parentTactic": "ta0043",
  "exercisesAdded": "2026-10-24"
}
