{
  "id": "t1480-001",
  "type": "technique",
  "title": "Execution Guardrails: Environmental Keying",
  "shortTitle": "Execution Guardrails: Environmental Keying",
  "externalId": "T1480.001",
  "theme": "Stealth",
  "summary": "Environmental keying is the cryptographic form of an execution guardrail. Rather than comparing a value and branching, the payload is stored encrypted and the decryption key is derived from a value that exists only in the intended environment, such as a network share name, a hardware or device identifier, an installed software version, the contents of a specific file, the Active Directory domain, the system time, or a local or external address. On the correct host the derived key is right, the payload decrypts in memory and runs; anywhere else the same code produces a wrong key and meaningless output, so a sandbox, a malware analyst or a crowdsourced sample set gets nothing that explains the behaviour. The technique is therefore a form of obfuscation aimed at protecting the operator's tradecraft, and it deliberately slows incident response because the interesting logic is not recoverable until an analyst reproduces the environmental inputs. It is also a strong hint about intent: a payload that only decrypts on one machine was written for that machine. The distinguishing property relative to the plain guardrail parent is that the check is not a visible test that can be logged as a comparison, because the verification is the decryption itself. Detection consequently has to work around the encryption: correlate delivery of similarly named samples that behave differently on different hosts, hunt for code that reads unusual system values early in execution, look for environment discovery and file reads of host identifiers, and treat repeated probing of machine specific values as suspicious even when nothing else follows it.",
  "tags": [
    "defense evasion",
    "execution guardrails",
    "environmental keying",
    "encryption",
    "anti analysis",
    "targeted attack"
  ],
  "difficulty": "extreme",
  "relatedTopics": [],
  "sources": [
    {
      "label": "MITRE ATT&CK: Execution Guardrails: Environmental Keying",
      "url": "https://attack.mitre.org/techniques/T1480.001/"
    }
  ],
  "lastReviewed": "2026-10-08",
  "exercises": [
    {
      "title": "Execution Guardrails: Environmental Keying - EASY",
      "path": "exercises/techniques/t1480-001/batch-easy.html",
      "difficulty": "easy",
      "kind": "exam",
      "status": "missing",
      "summary": "Recall and recognition: definitions, one clear answer, single-step questions."
    },
    {
      "title": "Execution Guardrails: Environmental Keying - MEDIUM",
      "path": "exercises/techniques/t1480-001/batch-medium.html",
      "difficulty": "medium",
      "kind": "exam",
      "status": "missing",
      "summary": "Application: read a short log or alert and choose the correct next step."
    },
    {
      "title": "Execution Guardrails: Environmental Keying - HARD",
      "path": "exercises/techniques/t1480-001/batch-hard.html",
      "difficulty": "hard",
      "kind": "exam",
      "status": "missing",
      "summary": "Analysis: a multi-step scenario with distractors, evidence to weigh, and a reason to give."
    },
    {
      "title": "Execution Guardrails: Environmental Keying - EXTREMELY HARD",
      "path": "exercises/techniques/t1480-001/batch-extremely-hard.html",
      "difficulty": "extremely-hard",
      "kind": "exam",
      "status": "missing",
      "summary": "Synthesis under pressure: incomplete evidence, competing priorities, and a decision you must defend."
    }
  ],
  "attributionNote": "Technique content is derived from the publicly available MITRE ATT&CK knowledge base. ATT&CK is a registered trademark of The MITRE Corporation. Cyber Pulse Academy is not affiliated with, endorsed by, or sponsored by MITRE, and this content is not official MITRE material.",
  "beginner": {
    "definition": "This is a stronger version of a guardrail. The harmful code is kept locked, like a message in a safe. The key to the safe is made from something that exists only on the chosen computer, such as its domain name or an address. On any other computer the key does not open the safe.",
    "whyItMatters": "An analyst cannot read code that will not unlock. Even if the file is captured, it stays meaningless on a test machine, so learning how it works takes far longer. That delay helps the attacker while defenders are still trying to understand what happened. It also tells you something important: a file built to unlock on one machine was aimed at that machine. This is the difference from the parent technique, where the code still runs and simply stops; here there is nothing readable to stop.",
    "howItWorks": [
      "The attacker chooses a fact that is unique to the target environment and stable over time.",
      "They encrypt the harmful part of the code with a key derived from that fact, and ship the locked content.",
      "When it starts, it reads the chosen value from the computer, such as a domain or an address.",
      "It turns that value into a key and tries to unlock the content in memory.",
      "On the correct machine the content is valid and runs; on any other machine it stays locked.",
      "Because the check happens inside the unlocking step, there is no clear comparison to observe in a log."
    ],
    "example": "Imagine a parcel locked with a combination that only opens when dialled to the number on a particular flat's front door. The courier service hands identical boxes to everyone on the street. Only one resident can open theirs, and the neighbour who tries finds the box simply will not turn. Investigators who collect the other boxes learn the shape of the box and nothing about what was inside, because the contents stay locked away.",
    "takeaways": [
      "A payload that only unlocks on one host was built for that host.",
      "Encrypted payloads hide their logic from analysis until the key value is known.",
      "Hunt for code that reads machine and domain details very early in execution."
    ]
  },
  "objectives": [
    "Explain how environmental keying uses cryptography as an execution condition.",
    "List environment values commonly used to derive a decryption key.",
    "Compare environmental keying with the non-cryptographic guardrails in the parent technique.",
    "Explain why keyed payloads slow down analysis and incident response.",
    "Describe hunting approaches for code that reads host-specific values at startup."
  ],
  "isSubTechnique": true,
  "parentTechnique": "t1480",
  "parentTactic": "ta0005"
}
